{
  "month": "2026-09",
  "currency": "CNY",
  "total_income": 12000,
  "total_expenses": 8000,
  "balance": 4000,
  "savings_rate": 0.3333333333333333,
  "consumption_structure": [
    {"category": "住房", "amount": 3000, "share": 0.375},
    {"category": "餐饮", "amount": 1800, "share": 0.225},
    {"category": "交通", "amount": 800, "share": 0.1},
    {"category": "学习", "amount": 900, "share": 0.1125},
    {"category": "娱乐", "amount": 600, "share": 0.075},
    {"category": "健康", "amount": 500, "share": 0.0625},
    {"category": "其他", "amount": 400, "share": 0.05}
  ],
  "large_expenses": [
    {"category": "住房", "amount": 3000, "share": 0.375},
    {"category": "餐饮", "amount": 1800, "share": 0.225}
  ],
  "month_over_month": {
    "income_change_percent": 20.0,
    "expenses_change_percent": -2.4390243902439024,
    "balance_change_percent": 122.22222222222223,
    "savings_rate_change_percentage_points": 15.333333333333332
  },
  "anomalies": ["餐饮支出高于个人近三个月平均水平"],
  "ai_analysis": "本月收入增加且支出略有下降，结余明显改善；餐饮支出值得关注。",
  "next_month_focus": ["关注餐饮支出", "维持储蓄水平"]
}
